{
  "schemaVersion": "0.2.0",
  "action": "complete",
  "disposition": "complete",
  "report": {
    "schemaVersion": "0.2.0",
    "planSha256": "fea29941df0231d725673f98bdb54292de3a63b8219dc286013edcd44d1ec25f",
    "artifactSha256": "7467f270eef935ca6d6b59b12e7a9418e422ec1e568122fcad378feb0a03d112",
    "status": "pass",
    "summary": {
      "total": 15,
      "pass": 15,
      "fail": 0,
      "unknown": 0,
      "critical": 0,
      "error": 0,
      "warning": 0
    },
    "findings": [
      {
        "ruleId": "plan.valid",
        "severity": "info",
        "status": "pass",
        "location": "plan",
        "expected": "content, facts and binding agree with the support manifest",
        "observed": true,
        "classification": "non-repairable"
      },
      {
        "ruleId": "html.structure",
        "severity": "info",
        "status": "pass",
        "location": "artifact",
        "expected": "complete, balanced HTML document",
        "observed": [],
        "classification": "non-repairable"
      },
      {
        "ruleId": "html.self_contained",
        "severity": "info",
        "status": "pass",
        "location": "artifact",
        "expected": "static self-contained HTML",
        "observed": [],
        "classification": "non-repairable"
      },
      {
        "ruleId": "facts.unique",
        "severity": "info",
        "status": "pass",
        "location": "artifact",
        "expected": "7 unique fact markers",
        "observed": 7,
        "classification": "non-repairable"
      },
      {
        "ruleId": "facts.exact",
        "severity": "info",
        "status": "pass",
        "location": "artifact",
        "expected": "7 exact facts",
        "observed": 7,
        "classification": "non-repairable"
      },
      {
        "ruleId": "facts.approved_text",
        "severity": "info",
        "status": "pass",
        "location": "body",
        "expected": "all visible source text belongs to approved facts",
        "observed": [],
        "classification": "non-repairable"
      },
      {
        "ruleId": "move.semantics",
        "severity": "info",
        "status": "pass",
        "location": "title",
        "expected": "the unique title fact in a level-one heading",
        "observed": "present",
        "classification": "non-repairable"
      },
      {
        "ruleId": "move.semantics",
        "severity": "info",
        "status": "pass",
        "location": "datum.label-value",
        "expected": "label and primary value in one Datum section",
        "observed": {
          "sectionCount": 1,
          "label": true,
          "value": true,
          "sameOrderedSection": true
        },
        "classification": "non-repairable"
      },
      {
        "ruleId": "render.binding",
        "severity": "info",
        "status": "pass",
        "location": "render_evidence",
        "expected": {
          "planSha256": "fea29941df0231d725673f98bdb54292de3a63b8219dc286013edcd44d1ec25f",
          "artifactSha256": "7467f270eef935ca6d6b59b12e7a9418e422ec1e568122fcad378feb0a03d112"
        },
        "observed": null,
        "classification": "renderer-or-configuration"
      },
      {
        "ruleId": "render.viewport_fit",
        "severity": "info",
        "status": "pass",
        "location": "viewport:320x844",
        "expected": "horizontal fit, readable body and no browser/resource errors",
        "observed": {
          "clientWidth": 320,
          "clientHeight": 844,
          "scrollWidth": 320,
          "scrollHeight": 844
        },
        "classification": "non-repairable"
      },
      {
        "ruleId": "render.facts",
        "severity": "info",
        "status": "pass",
        "location": "viewport:320x844",
        "expected": "7 exact, visible, unclipped and unobscured facts",
        "observed": 7,
        "classification": "non-repairable"
      },
      {
        "ruleId": "facts.approved_text",
        "severity": "info",
        "status": "pass",
        "location": "viewport:320x844",
        "expected": "no unapproved visible text",
        "observed": [],
        "classification": "non-repairable"
      },
      {
        "ruleId": "render.semantics",
        "severity": "info",
        "status": "pass",
        "location": "viewport:320x844",
        "expected": {
          "move": "Datum",
          "oneVisibleH1": true,
          "relationships": [
            {
              "id": "datum.label-value",
              "passed": true
            }
          ]
        },
        "observed": {
          "move": "Datum",
          "oneVisibleH1": true,
          "relationships": [
            {
              "id": "datum.label-value",
              "passed": true
            }
          ]
        },
        "classification": "non-repairable"
      },
      {
        "ruleId": "instrument.invariant_band",
        "severity": "info",
        "status": "pass",
        "location": "viewport:320x844",
        "expected": {
          "count": 1,
          "containsTitle": true,
          "x": 0,
          "width": 320,
          "height": 32,
          "backgroundColor": "rgb(17, 17, 17)",
          "titleColor": "rgb(255, 255, 255)",
          "borderWidths": {
            "top": 0,
            "right": 0,
            "bottom": 0,
            "left": 0
          }
        },
        "observed": {
          "count": 1,
          "containsTitle": true,
          "bounds": {
            "x": 0,
            "y": 0,
            "width": 320,
            "height": 32
          },
          "backgroundColor": "rgb(17, 17, 17)",
          "titleColor": "rgb(255, 255, 255)",
          "borderWidths": {
            "top": 0,
            "right": 0,
            "bottom": 0,
            "left": 0
          }
        },
        "classification": "non-repairable"
      },
      {
        "ruleId": "render.screenshot",
        "severity": "info",
        "status": "pass",
        "location": "viewport:320x844",
        "expected": "hash-matched embedded PNG with declared width and captured height",
        "observed": {
          "file": "datum-320x844.png",
          "sha256": "1155b770a75dfcedc8d868b77522288bb5c7e337d01fd998c0bc73248b69fafd"
        },
        "classification": "renderer-or-configuration"
      }
    ],
    "limitations": [
      "Supports the six Instrument HTML workflows declared by the exact support-manifest bytes.",
      "Visual quality, rhetorical effectiveness and full accessibility compliance are unassessed.",
      "Source visibility is conservative; CSS layout and clipping require current browser evidence.",
      "Render evidence is caller supplied and hash-bound, not an attestation of browser execution.",
      "Vertical document scrolling is permitted; required horizontal viewport fit is checked."
    ]
  },
  "record": {
    "schemaVersion": "0.2.0",
    "planSha256": "fea29941df0231d725673f98bdb54292de3a63b8219dc286013edcd44d1ec25f",
    "artifactSha256": "7467f270eef935ca6d6b59b12e7a9418e422ec1e568122fcad378feb0a03d112",
    "reportSha256": "9e3e959e60267d0c479dd6ee75bc429a33b45839513d79ce000863fe684e9036",
    "parentRecordSha256": null,
    "attempt": 0,
    "repairAttempt": 0,
    "baseArtifactSha256": null,
    "disposition": "complete",
    "accepted": true,
    "bestArtifactSha256": "7467f270eef935ca6d6b59b12e7a9418e422ec1e568122fcad378feb0a03d112",
    "nextAction": "complete",
    "snapshot": {
      "artifactSha256": "7467f270eef935ca6d6b59b12e7a9418e422ec1e568122fcad378feb0a03d112",
      "reportSha256": "9e3e959e60267d0c479dd6ee75bc429a33b45839513d79ce000863fe684e9036",
      "status": "pass",
      "freshEvidence": true,
      "protected": {
        "plannedFacts": 7,
        "sourceFailures": [],
        "visibleFailures": [],
        "requiredRelationships": 1,
        "relationshipFailures": [],
        "criticalErrorFindings": []
      },
      "acceptanceMetrics": {
        "contractPass": true,
        "briefPass": true,
        "visibleFactCoverage": [
          {
            "viewport": "viewport:320x844",
            "preserved": 7,
            "total": 7,
            "basisPoints": 10000
          }
        ],
        "minimumVisibleFactCoverageBps": 10000,
        "staticCoverageBps": 10000,
        "contractFactCoverageBps": 10000,
        "severityCounts": {
          "critical": 0,
          "error": 0,
          "warning": 0,
          "unknown": 0
        }
      },
      "findingFingerprints": [],
      "selectionKey": [
        0,
        0,
        0,
        0,
        0,
        0,
        0,
        0,
        0
      ]
    },
    "recordSha256": "3522f6c8db3c65df7c47bce10de98089e6f9827276be3a8da2370835210fe71e"
  },
  "remainingRepairs": 2,
  "bestArtifactSha256": "7467f270eef935ca6d6b59b12e7a9418e422ec1e568122fcad378feb0a03d112",
  "nextRepairBaseArtifactSha256": null,
  "rollbackArtifactSha256": null,
  "reasons": [
    "The fresh baseline passes every check."
  ],
  "classifiedFindings": [],
  "instructions": []
}
